{
  "$schema": "https://json-schema.org/draft/2020-12/schema",
  "$id": "https://raw.githubusercontent.com/timtimlive/timtim-openapi/main/schemas/Problem.schema.json",
  "title": "Problem",
  "$comment": "GENERATED from openapi.yaml by scripts/generate.mjs. Do not edit.",
  "type": "object",
  "required": [
    "type",
    "title",
    "status",
    "detail",
    "request_id",
    "code"
  ],
  "properties": {
    "type": {
      "type": "string",
      "format": "uri"
    },
    "title": {
      "type": "string",
      "examples": [
        "We could not find that city."
      ]
    },
    "status": {
      "type": "integer"
    },
    "detail": {
      "type": "string"
    },
    "request_id": {
      "type": "string"
    },
    "code": {
      "type": "string",
      "description": "A stable name for what went wrong, e.g. invalid_cursor, idempotency_conflict."
    },
    "allowed": {
      "type": "array",
      "items": {
        "type": "string"
      },
      "description": "405 only: the methods this address answers (also in the Allow header)."
    }
  }
}
